title,full_text,category,source
The secrets of a great sex life: how to keep the flame alive in the bedroom,"<p>Sex is an appetite like any other and there is much you can do to make it a priority, from making sure you find the time for it to building your confidence and maintaining intimacy throughout the day</p><p><a href=""https://www.theguardian.com/global/2025/dec/17/sign-up-for-how-to-have-a-better-day-our-16-part-series-on-how-to-improve-your-life"">• Sign up here to get the whole series straight to your inbox</a></p><p>If you have sex, chances are, you’ll have a good day. But scheduling it makes it feel like a chore. And unlike any other chore or fitness enterprise, you conceive it more as self-indulgence than self-improvement, and as such, even if you’re already in a relationship, it’s hard to find that chin-out determination to get it done. Yet sex is an appetite like any other, a necessity like any other, a nourishment like any other. If you let it go dormant the effect on your relationship might be as if one or both of you are on a permanent diet – and also lonely. That might be fine for both of you, but for many of us, sex is a thing worth prioritising.</p><p>At its core, before you introduce any other domestic obstacles, it’s a two-person job, so you have to be attuned to one another; you can’t just decide unilaterally. To take this in ascending order of hurdles; if you’re a childless couple, the main block is going to be each other – not being in the same mood at the same time, not being in the house at the same time. This is true for your entire relationship, not just sex; I once interviewed a fertility doctor, who described working with a couple, trying to find an appointment time for when one was ovulating and both were in the country. They scrolled through several weeks before they managed it. “I felt as if I was beginning to get to the bottom of why they couldn’t conceive,” she said.</p> <a href=""https://www.theguardian.com/lifeandstyle/2025/dec/19/the-perfect-way-to-keep-the-flame-alive-in-the-bedroom"">Continue reading...</a>",fact,news
The mood was jubilant at Italy’s far-right Atreju festival. But has Meloni’s success peaked? | Jamie Mackay,"<p>The prime minister has been lauded for her country’s growing role on the world stage. But poverty and precarity are forcing vast numbers to emigrate</p><p></p><p>Earlier this month, the gardens of Rome’s Castel Sant’Angelo were filled with families enjoying some unseasonably warm sun by a pop-up ice rink. Teenage couples skated hand in hand, while the watching crowds sipped mulled wine and hot chocolate to a soundtrack of Nat King Cole. At first glance, it <a href=""https://www.theguardian.com/world/2025/dec/12/giorgia-meloni-atreju-brothers-of-italy-far-right"">looked like a normal Christmas market</a>. The stands, however, revealed a different reality. Among the nativity displays and kitsch decorations were adverts for nationalist newspapers and something called “patriot radio”. On a wall near the kids’ play area, a mural depicted an unlikely cast of characters, tracing a lineage from the fascist poet Gabriele D’Annunzio to the late American Maga influencer Charlie Kirk.</p><p>This was the setup I witnessed at this year’s Atreju, Italy’s biggest rightwing festival, which has been running since 1998 as an <a href=""https://www.theguardian.com/world/2025/dec/12/giorgia-meloni-atreju-brothers-of-italy-far-right"">annual celebration of patriotism</a> and nationalism. During the early editions, proud neo-fascists, including black-hooded thugs from street movements such as CasaPound and Forza Nuova, made up a visible portion of the attenders. At this year’s event, however, the Celtic crosses and odal rune tattoos were tucked under well-ironed shirts. The crowd was made up of nerdy students, gen-Z influencers, civil society campaigners and passersby who had been lured off the street by the glittery lights.</p><p>Jamie Mackay is a writer and translator based in Florence<br /></p> <a href=""https://www.theguardian.com/commentisfree/2025/dec/29/italy-far-right-atreju-festival-giorgia-meloni"">Continue reading...</a>",fact,news
"The very next day, you gave it away … how to get rid of an unwanted Christmas gift without getting caught| Eleanor Limprecht","<p>When a friend found out the painting she’d given me had made its way to a charity store, I wanted to dig a hole in the earth</p><p>As the recipient of an unwanted gift, is it necessary to pretend you like it? This is what most of us are trained to do as children; for some it was our first experience of being instructed to lie.</p><p><em>“</em>Thank you,” I might have said to my grandmother, “for this frilly, itchy lace-trimmed dress identical to the one you gave my sister. I love it.”</p> <a href=""https://www.theguardian.com/commentisfree/2025/dec/30/how-to-get-rid-of-an-unwanted-christmas-gift"">Continue reading...</a>",fact,news
The hill I will die on: Pigeons are working-class heroes and deserve some respect | Toussaint Douglass,"<p>These unfairly maligned animals were nuggets for our ancestors and served for the UK during the second world war</p><p></p><p>Is there something I would figuratively die on a hill for? Yes, there is – and as it happens, I’m sitting on a literal hill right now, feeding them. Pigeons. Why pigeons? Because it’s about time they get the respect they deserve.</p><p>I like pigeons. Because they’re like me, working class. You can tell pigeons are working class because every pigeon looks knackered. It’s about this point in the conversation that people politely make their excuses and slowly back away (literally) while avoiding eye contact. No doubt, reading this, you are doing the same (figuratively).</p><p>Toussaint Douglass is a comedian from Lewisham, south London. His show <a href=""https://sohotheatre.com/events/toussaint-douglass-accessible-pigeon-material-2/"">Accessible Pigeon Material</a> will be showing at Soho Theatre, 26-31 January 2026</p> <a href=""https://www.theguardian.com/commentisfree/2025/dec/29/hill-die-on-pigeons-working-class-heroes-deserve-respect"">Continue reading...</a>",fact,news
The Guardian view on the new space race: humanity risks exporting its old politics to the moon | Editorial,"<p>Over the holiday period, the Guardian leader column is looking ahead at the themes of 2026. Today we look skyward, where a new lunar contest mirrors humanity’s struggle to live within planetary limits</p><p>During the cold war’s space race, the Apollo moon missions were driven by the need to prove American superiority. Having made that political and technological point with the 1969 moon landing, the contest between Moscow and Washington petered out. A new dash across the skies kicks off in <a href=""https://www.bbc.co.uk/news/articles/cxwwjlrk1mlo"">2026</a>, reigniting geopolitical competition under the guise of “<a href=""https://www.nasa.gov/artemis-accords/"">peaceful exploration</a>”. The moon’s south pole is emerging as the most valuable <a href=""https://qz.com/1512196/the-peaks-of-eternal-light-are-the-most-valuable-real-estate-on-the-moon"">real estate </a>in the solar system, offering “<a href=""https://en.wikipedia.org/wiki/Peak_of_eternal_light"">peaks of eternal light</a>” for solar arrays and<a href=""https://www.weforum.org/stories/2023/08/space-water-ice-moon-south-pole/""> ice deposits</a> in craters shielded from&nbsp;the&nbsp;sun.</p><p>The US and a China-led bloc are eyeing the lunar surface and its potential to control a post-terrestrial economy. Space had been humanity’s last commons, supposedly shielded by the 1967 UN outer space treaty that bans state exploitation of the heavens. It is vague, however, on private claims – a loophole that is now fuelling a tycoon-led scramble for the stars. The aim is obvious: to act first, shape norms and dare others to object. Two lunar missions launching next year– Nasa’s <a href=""https://www.reuters.com/science/first-us-artemis-astronaut-mission-around-moon-track-april-officials-say-2025-09-23/"">Artemis II</a> and China’s <a href=""https://www.scmp.com/news/china/science/article/3329997/china-led-moon-missions-water-probe-will-be-first-humanity-space-agency"">Chang’e 7</a> – are competing for strategic supremacy.</p> <a href=""https://www.theguardian.com/commentisfree/2025/dec/28/the-guardian-view-on-the-new-space-race-humanity-risks-exporting-its-old-politics-to-the-moon"">Continue reading...</a>",fact,news
Ella Baron on Trump and Zelenskyy’s Ukraine peace talks – cartoon,"<a href=""https://www.theguardian.com/commentisfree/picture/2025/dec/28/ella-baron-trump-zelenskyy-ukraine-peace-talks-cartoon"">Continue reading...</a>",fact,news
Trump to meet Netanyahu at Mar-a-Lago amid concerns over progress on fragile Gaza truce plan – live,"<p>The Israeli prime minister left Israel on Sunday on his fifth visit to see Trump in the US this year</p><p>A reminder of the current winter in <strong>Gaza</strong> where most housing and infrastructure have been badly damaged or razed, and where in recent weeks heavy rain and cold temperatures have compounded the suffering.</p><p>More than 70,000 Palestinian people, mostly civilians, were killed in Gaza during Israel’s military assault on the territory, and almost all of its 2.3m population was displaced.</p> <a href=""https://www.theguardian.com/us-news/live/2025/dec/29/trump-netanyahu-israel-gaza-live"">Continue reading...</a>",fact,news
Hundreds of Detroit home demolition sites may have been filled with toxic dirt,"<p>Toxic chemicals like lead and asbestos are likely in dirt used to backfill demolished structures in city, experts say</p><p>Hundreds of Detroit home demolition sites were <a href=""https://www.freep.com/story/news/local/michigan/detroit/2025/12/22/toxic-dirt-detroitland-bank-cleanup/87881313007/"">potentially backfilled</a> with toxic construction debris from a demolished shopping mall and other sources, creating an unfolding public health threat in the city’s neighborhoods.</p><p>Detroit, the nation’s lowest income big city, is in the US industrial heartland. It was left with tens of thousands of empty structures as industrial plants closed and people left the city in past decades – Detroit’s population dropped from nearly 2 million people around 1950 to fewer than 700,000 today. The city’s demolition program is widely considered the largest ever in the US.</p> <a href=""https://www.theguardian.com/us-news/2025/dec/29/detroit-home-demolition-sites-toxic-dirt"">Continue reading...</a>",fact,news
Marjorie Taylor Greene says she was ‘naive’ for believing Trump is man of the people,"<p>Greene gives lengthy interview with New York Times days before stepping down as congresswoman for Georgia</p><p>Marjorie Taylor Greene, now just days away from stepping down as a congresswoman for Georgia, has said in her latest mea culpa interview that she “was just so naive” for believing that Donald Trump was a man of the people.</p><p><a href=""https://www.nytimes.com/2025/12/29/magazine/marjorie-taylor-greene-trump-maga-split.html"">In a lengthy interview with the New York Times</a> that examines her break with the president after years of devotion, Greene explained that a series of minor ruptures with the president culminated in a total breach after conservative influencer Charlie Kirk was killed in September.</p> <a href=""https://www.theguardian.com/us-news/2025/dec/29/marjorie-taylor-greene-trump-interview"">Continue reading...</a>",fact,news
Many Filipino healthcare workers in the US live in fear of ICE: ‘This is my place of work. I should feel safe’,"<p>Filipinos make up a large percentage of the healthcare workforce, which includes undocumented people</p><p>In the Philippines, she spent three years providing end-of-life care for a family’s grandmother. When the grandmother died, family members told the healthcare worker to arrange her own way to the United States, where they operated home healthcare facilities.</p><p>In California, they promised, she would have a place to stay and a stable job. They would look after her just as she had cared for their grandmother.</p> <a href=""https://www.theguardian.com/us-news/2025/dec/29/filipino-healthcare-workers-immigration-trump"">Continue reading...</a>",fact,news
"Two half-brothers, in prison for killing a priest, tell a story of abuse in New Orleans","<p>Father Patrick McCarthy was brutally murdered in 1988. The two half-brothers in prison for the killing say he sexually abused them for years</p><p>More than 600 alleged survivors of clergy abuse have claims against the Roman Catholic archdiocese of <a href=""https://www.theguardian.com/us-news/new-orleans"">New Orleans</a> in its long bankruptcy. Attorneys Frank Lamothe III and Kristi Schubert have 75 clients. Twenty-three of them are prisoners, and most of them allege abuse at two long-shuttered orphanages, <a href=""https://www.theguardian.com/us-news/article/2024/aug/25/madonna-manor-orphanage-sexual-abuse-new-orleans"">Hope Haven and Madonna Manor</a>.</p><p>Two of these men had a different path to prison.</p> <a href=""https://www.theguardian.com/us-news/2025/dec/29/new-orleans-brothers-priest-killing-child-sexual-abuse"">Continue reading...</a>",fact,news
‘Just like so many families’: US parents of addicted kids relate to the Reiners – but fear stigma,"<p>The challenges of drug and alcohol addiction are familiar, but violence against others is highly unusual, parents say</p><p>When news broke that Rob and Michele Singer Reiner had been killed and a possible suspect was their son, Nick Reiner, who had struggled with addiction and mental health issues, it brought addiction back into the public spotlight. But parents who have been affected by their children’s addiction fear the conversation will focus on the exceedingly rare act of violence instead of the more widespread risks.</p><p>Ron Grover and his wife, Darlene, have been glued to the news. They only knew the Reiners by their work, but they feel a connection: Grover’s son also became addicted at 15 to opioids and then heroin, much like Nick Reiner, and he was in and out of rehab and jail for years. But after seven excruciating years, Grover’s son got sober in July 2010.</p> <a href=""https://www.theguardian.com/us-news/2025/dec/29/families-addiction-stigma-rob-reiner"">Continue reading...</a>",fact,news
From ‘global cooling’ to ‘beautiful coal’: Trump’s startling climate claims of 2025,"<p>Trump ratcheted up his questionable claims about the environment and how to deal, if at all, with the threats to it</p><p>In the past decade at the forefront of US politics, Donald Trump has unleashed a barrage of unusual, misleading or dubious assertions about the climate crisis, which he most famously called a “hoax”.</p><p>This year has seen Trump ratchet up his often questionable claims about the environment and how to deal, if at all, with the threats to it. In a year littered with lies and wild declarations, these are the five that stood out as the most startling.</p> <a href=""https://www.theguardian.com/us-news/2025/dec/29/trump-climate-claims-environment"">Continue reading...</a>",fact,news
Donald Trump in his own words – the year in racism and misogyny,"<p>The president has increased the amount of invective he’s spewed against women and people of color</p> <a href=""https://www.theguardian.com/us-news/2025/dec/29/donald-trump-racism-dei-misogyny-2025-review"">Continue reading...</a>",fact,news
FBI deploys more resources to ‘dismantle fraud schemes’ in Minnesota,"<p>Kash Patel claims $250m scheme that stole Covid aid is ‘tip of iceberg’ and alleges state’s Somalia population is to blame</p><p>The <a href=""https://www.theguardian.com/us-news/fbi"">FBI</a> has deployed additional personnel and investigative resources to <a href=""https://www.theguardian.com/us-news/minnesota"">Minnesota</a> to “dismantle large-scale fraud schemes exploiting federal programs”, director Kash Patel said on social media on Sunday.</p><p>The FBI director said the agency had already dismantled a <a href=""https://www.justice.gov/usao-mn/pr/federal-jury-finds-feeding-our-future-mastermind-and-co-defendant-guilty-250-million"">$250m fraud scheme</a> that stole federal food aid meant for vulnerable children during the Covid pandemic in a case that led to 78 indictments and 57 convictions.</p> <a href=""https://www.theguardian.com/us-news/2025/dec/28/fbi-minnesota-fraud-schemes-somalia"">Continue reading...</a>",fact,news
Bernie Sanders criticizes AI as ‘the most consequential technology in humanity’,"<p>Republican senator Katie Britt also proposes AI companies be criminally liable if they expose minors to harmful ideas</p><p>US senator <a href=""https://www.theguardian.com/us-news/bernie-sanders"">Bernie Sanders</a> amplified his recent criticism of <a href=""https://www.theguardian.com/technology/artificialintelligenceai"">artificial intelligence</a> on Sunday, explicitly linking the financial ambition of “the richest people in the world” to economic insecurity for millions of Americans – and calling for a potential moratorium on new <a href=""https://www.theguardian.com/technology/2025/dec/19/data-centers-ai-investment"">datacenters</a>.</p><p>Sanders, a Vermont independent who caucuses with the Democratic party, said on CNN’s State of the Union that he was “fearful of a lot” when it came to AI. And the senator called it “the most consequential technology in the history of humanity” that will “transform” the US and the world in ways that had not been fully discussed.</p> <a href=""https://www.theguardian.com/us-news/2025/dec/28/bernie-sanders-artificial-intelligence-ai-datacenters"">Continue reading...</a>",fact,news
"US strikes on Nigeria and Syria are ‘consistent’ with policy to combat IS, Republican says","<p>House armed services committee’s Mike Turner denied that military strikes showed new Trump approach to US forces</p><ul><li><p><a href=""https://www.theguardian.com/world/2025/dec/26/us-warns-of-more-nigeria-strikes-as-abuja-talks-of-joint-ongoing-operations"">US warns of more Nigeria strikes as Abuja talks of ‘joint ongoing operations’</a></p></li></ul><p>A senior <a href=""https://www.theguardian.com/us-news/republicans"">Republican</a> on the US House armed services committee has said that the country’s recent <a href=""https://www.theguardian.com/world/2025/dec/26/nigeria-why-did-trump-order-us-strikes-bomb-attack-isis-christians"">military strikes</a> in Nigeria and Syria are consistent with American foreign policy to combat Islamic extremism that have existed across <a href=""https://www.theguardian.com/us-news/donaldtrump"">Donald Trump</a>’s two presidential terms.</p><p>Mike Turner, an Ohio congressman, said on Sunday that the strikes are a “continuation of our conflict with [the Islamic State]”.</p> <a href=""https://www.theguardian.com/us-news/2025/dec/28/military-strikes-nigeria-syria-trump-islamic-state"">Continue reading...</a>",fact,news
Trump urges Republicans to ditch filibuster rule in US Senate,"<p>Rule allows minority party to block legislation, but GOP is reluctant to scrap it as they could lose majority</p><p><a href=""https://www.theguardian.com/us-news/donaldtrump"">Donald Trump</a> has floated the idea of ending the filibuster – a procedural technique in <a href=""https://www.theguardian.com/us-news/us-congress"">Congress</a> that allows a minority of senators to block legislation from passing – which would make pushing through his political agenda in 2026 much easier.</p><p>In an interview with <a href=""https://www.politico.com/news/2025/12/27/trump-to-politico-midterm-elections-will-be-about-pricing-00706877"">Politico</a>, the president urged <a href=""https://www.theguardian.com/us-news/republicans"">Republicans</a> in the <a href=""https://www.theguardian.com/us-news/us-senate"">Senate</a> to scrap the filibuster, saying it had become an obstacle to effective governing and removing it would prevent another government shutdown and pave the way for his party to push through its legislative priorities.</p> <a href=""https://www.theguardian.com/us-news/2025/dec/27/trump-republicans-filibuster-rule-senate"">Continue reading...</a>",fact,news
Americans are waking up. A grand reckoning awaits us | Robert Reich,"<p>I’d like to believe that the horrific darkness of this past year is a necessary prelude to a brighter and saner future</p><p>About a year ago, at the start of the <a href=""https://www.theguardian.com/us-news/donaldtrump"">Trump</a> 2.0 regime, a woman was about to pass me on the sidewalk and then stopped, turned toward me and almost shouted: “It’s a fucking nightmare!”</p><p>It <em>has </em>been a “fucking nightmare”.</p> <a href=""https://www.theguardian.com/commentisfree/2025/dec/29/american-reckoning"">Continue reading...</a>",fact,news
US strikes on IS targets in Nigeria may only fan the flames of insurgent violence | Onyedikachi Madueke,"<p>The public is looking for relief from terrorism and violence. But Donald Trump’s words bolster narratives of foreign ‘crusader’ aggression</p><p>The response of Nigerians to the <a href=""https://www.theguardian.com/us-news/2025/dec/25/us-carries-out-airstrikes-against-islamic-state-terrorist-scum-in-nigeria-trump-says"">airstrikes</a> against Islamic State (IS) targets in Sokoto state, north-western Nigeria are complicated. The rationale behind them has been widely opposed, but the strikes themselves have been welcomed.</p><p>The airstrikes were framed as a response to what have been described as genocidal <a href=""https://www.cbsnews.com/news/u-s-launches-strikes-on-isis-targets-in-nigeria-trump-says/"">attacks on Christians</a> in the country. But the Nigerian authorities have consistently <a href=""https://guardian.ng/news/nigerian-officials-reject-christian-genocide-claims-in-talks-with-us-congressman/"">rejected</a> this narrative, arguing that armed groups in the country do not discriminate based on religion, and that Christians and Muslims largely coexist peacefully. Ironically, it was Trump’s redesignation of Nigeria as a “<a href=""https://www.theguardian.com/us-news/2025/nov/01/trump-nigeria-christian-persecution"">country of particular concern</a>” in November that deepened Muslim-Christian tensions. Many northerners, who are predominantly Muslim, blamed southern Nigerians for championing a narrative that ultimately resulted in US sanctions and international stigma.</p><p>Onyedikachi Madueke is a security analyst at the University of Aberdeen</p> <a href=""https://www.theguardian.com/commentisfree/2025/dec/28/us-strikes-nigeria-donald-trump-crusader-terrorism-is-targets"">Continue reading...</a>",fact,news
"Through the lens of history, Trump's legacy will be more of a blotch than a Maga masterpiece | Simon Tisdall","<p>Take this hopeful thought into 2026: the tyrants we endure always falter, and their ‘seismic’ upheavals are usually false dawns</p><p>For those who lived through the cold war, the fall of the Berlin Wall on 9 November 1989, was an unforgettable moment. The sinister watch towers with their searchlights and armed guards, the minefields in no-man’s land, the notorious Checkpoint Charlie border post, and the Wall itself – <a href=""https://www.theguardian.com/world/from-the-archive-blog/2019/oct/30/the-fall-of-the-berlin-wall-archive-november-1989"">all were swept aside</a> in an extraordinary, popular lunge for freedom.</p><p>Less than a month later, on 3 December 1989, at a summit in Malta, US president George HW Bush and Soviet leader Mikhail Gorbachev declared that after more than 40 years, <a href=""https://www.theguardian.com/world/2024/nov/27/malta-summit-ends-the-cold-war-archive-1989"">the cold war was over</a>. All agreed it was a historic turning point.</p><p>Simon Tisdall is a Guardian foreign affairs commentator</p> <a href=""https://www.theguardian.com/commentisfree/2025/dec/28/donald-trump-legacy-maga-2026-tyrants"">Continue reading...</a>",fact,news
"US capitalism casts millions of citizens aside, yet Badenoch and Farage still laud it | Phillip Inman","<p>Rightwing parties want to follow in US’s footsteps of minimal government intervention, but at what cost?</p><p>Next month, Donald Trump will welcome a poverty-stricken family to peruse his plans for a $300m glitzy state ballroom in the White House. The event will be staged as part of National Poverty in America Awareness Month, the time every year when charities document the number of US residents surviving on low incomes.</p><p>Of course, the president will do no such thing, preferring to summon the press to watch him rub shoulders with the billionaire class as he did at last month’s black tie <a href=""https://www.theguardian.com/us-news/2025/nov/18/trump-bin-salman-visit-jamal-khashoggi"">dinner for the Saudi ruler</a> and his entourage.</p> <a href=""https://www.theguardian.com/business/2025/dec/28/us-capitalism-casts-millions-of-citizens-aside-yet-badenoch-and-farage-still-laud-it"">Continue reading...</a>",fact,news
