title,full_text,category,source
Anthony Joshua injured in car crash in Nigeria that killed two people,"<ul><li><p>British former boxing champion sustained minor injuries</p></li><li><p>Two people killed in collision, say police in Ogun State</p></li></ul><p>British heavyweight boxer Anthony Joshua was injured in a car crash in Nigeria on Monday morning that killed two people, local police said.</p><p>The former world heavyweight boxing champion was taken to an undisclosed hospital after his car hit a stationary vehicle at around 11am on the Lagos-Ibadan Expressway, Ogun state police commissioner Lanre Ogunlowo said. The driver of Joshua’s vehicle was also injured, he added.</p> <a href=""https://www.theguardian.com/sport/2025/dec/29/anthony-joshua-injured-car-crash-nigeria"">Continue reading...</a>",fact,news
Central African Republic goes to polls as president seeks third term,"<p>Opposition hopes to tap into frustrations of people living in country where conflict remains a daily reality</p><p>Central African Republic goes to the polls on Sunday with the president, Faustin-Archange Touadéra, seeking a third term.</p><p>As many as 2.3 million registered voters will cast ballots for what observers are calling a quadruple election: votes for the presidency and parliament as well as local and municipal offices.</p> <a href=""https://www.theguardian.com/world/2025/dec/28/central-african-republic-goes-to-polls-as-president-seeks-third-term"">Continue reading...</a>",fact,news
Opposition anger as Guinea’s junta leader is frontrunner to be elected president,"<p>Mamady Doumbouya accused of betraying his promise to be the restorer of democracy after leading 2021 coup</p><p>In September 2021, a tall, young colonel in the Guinean army announced that he and his comrades had <a href=""https://www.theguardian.com/world/2021/sep/06/guinea-president-held-in-military-detention-say-army-coup-leaders"">forcibly seized power</a> and toppled the longtime leader Alpha Condé.</p><p>“The will of the strongest has always supplanted the law,” Mamady Doumbouya said in a speech, stressing that the soldiers were acting to restore the will of the people.</p> <a href=""https://www.theguardian.com/world/2025/dec/27/guinea-junta-leader-mamady-doumbouya-frontrunner-president-election"">Continue reading...</a>",fact,news
Israel becomes first country to recognise Somaliland as sovereign state,"<p>Diplomatic breakthrough criticised by African Union, which said it could have ‘far-reaching implications for peace and stability across the continent’</p><p>Israel has become the first country to recognise Somaliland as a sovereign state, a breakthrough in its quest for international recognition since it declared independence from Somalia 34 years ago.</p><p>The Israeli foreign minister, Gideon Sa’ar, announced on Friday that Israel and Somaliland had signed an agreement establishing full diplomatic relations, which would include the opening of embassies and the appointment of ambassadors.</p> <a href=""https://www.theguardian.com/world/2025/dec/26/israel-first-country-to-recognise-somaliland-sovereign-state"">Continue reading...</a>",fact,news
British-Egyptian activist Alaa Abd el-Fattah arrives in UK after travel ban lifted,"<p>Family say campaigner, who has a son in Brighton, will be able to travel freely between UK and Cairo months after his release from Egyptian jail</p><p>The British-Egyptian dissident Alaa Abd el-Fattah has arrived in London after the Egyptian government lifted a travel ban that it had imposed on him despite <a href=""https://www.theguardian.com/world/2025/oct/11/i-deserve-to-heal-freed-british-egyptian-activist-alaa-abd-el-fattah-on-his-prison-ordeal-and-next-steps"">releasing him from jail in September</a>.</p><p>Abd el-Fattah had been held in jail nearly continuously for 10 years, mainly due to expressing his opposition to the treatment of dissidents by the Egyptian government. He had been detained in jail two years beyond his five-year sentence as the Cairo authorities refused to recognise the period he held in pre-trial detention as part of his time served.</p> <a href=""https://www.theguardian.com/world/2025/dec/26/british-egyptian-activist-alaa-abd-el-fattah-arrives-in-uk-after-travel-ban-lifted"">Continue reading...</a>",fact,news
Brazilian ex-president Bolsonaro treated for persistent hiccups,"<p>Doctors say they blocked his right phrenic nerve in procedure that took place after jailed former president was hospitalised last week for hernia operation</p><p>Brazil’s former president Jair Bolsonaro underwent “a phrenic nerve block procedure” on Saturday to treat his persistent hiccups, his wife, Michelle Bolsonaro, said on social media.</p><p>The doctors treating Bolsonaro said later that they blocked the right phrenic nerve and scheduled a new procedure in 48 hours to block the left one.</p> <a href=""https://www.theguardian.com/world/2025/dec/29/brazil-ex-president-jair-bolsonaro-hiccups-treatment"">Continue reading...</a>",fact,news
Venezuela says it released 99 people detained for 2024 election protests,"<p>Government said the move was due to its ‘unrestricted respect for human rights’ in the face of US aggression</p><p><a href=""https://www.theguardian.com/world/venezuela"">Venezuela</a> has said it has carried out its largest release of political prisoners this year, claiming to have freed 99 people detained for taking part in protests after the 2024 election, widely believed to have been stolen by the dictator <a href=""https://www.theguardian.com/world/nicolas-maduro"">Nicolás Maduro</a>, as it comes under increasing military pressure from the US.</p><p>Civil society organisations have treated the news with caution and stressed that the releases were insufficient, noting that at least 900 political prisoners remain in the country.</p> <a href=""https://www.theguardian.com/world/2025/dec/26/venezuela-political-prisoner-release"">Continue reading...</a>",fact,news
Weather tracker: Deep freeze grips Canada as US records warmest Christmas,"<p>Temperatures plunge below -50C in the Yukon, while swaths of US experience springlike weather</p><p>Northern Canada has been gripped by an intense and prolonged cold spell, with temperatures hovering between -20C and -40C for weeks. On Tuesday, Braeburn in the Yukon recorded -55.7C, its coldest December temperature since 1975.</p><p>Meanwhile, Mayo and Dawson endured 16 consecutive nights below -40C, with Mayo plunging to -50.4C on Monday. Whitehorse also recorded 10 nights when temperatures dropped below -30C.</p> <a href=""https://www.theguardian.com/world/2025/dec/26/weather-tracker-deep-freeze-canada-us-records-warmest-christmas"">Continue reading...</a>",fact,news
‘They’re scared of us now’: how co-investment in a tropical forest saw off loggers,"<p>Low-cost tech and joined-up funding have reduced illegal logging, mining and poaching in the Darién Gap – it’s a success story that could stop deforestation worldwide</p><p>There are no roads through the Darién Gap. This vast impenetrable forest spans the width of the land bridge between South and Central America, but there is almost no way through it: hundreds have lost their lives trying to cross it on foot.</p><p>Its size and hostility have shielded it from development for millennia, protecting hundreds of species – from harpy eagles and giant anteaters to jaguars and red-crested tamarins – in one of the most biodiverse places on Earth. But it has also made it incredibly difficult to protect. Looking after 575,000 hectares (1,420,856 acres) of beach, mangrove and rainforest with just 20 rangers often felt impossible, says Segundo Sugasti, the director of Darién national park. Like tropical forests all over the world, it has been steadily shrinking, with at least 15% lost to logging, mining and cattle ranching in two decades.</p> <a href=""https://www.theguardian.com/environment/2025/dec/25/they-are-scared-of-us-now-how-one-tropical-forest-turned-the-tide-on-loggers"">Continue reading...</a>",fact,news
"‘It’s the wildest place I have walked’: new national park will join up Chile’s 2,800km wildlife corridor","<p>Government poised to officially protect 200,000 hectares of remote Patagonian coastline and forest </p><p>Chile’s government is poised to create the country’s 47th national park, protecting nearly 200,000 hectares (500,000 acres) of pristine wilderness and completing a <a href=""https://www.theguardian.com/travel/2019/sep/26/patagonia-chile-routes-parks-national-tompkins"">wildlife corridor</a> stretching 1,700 miles (2,800km) to the southernmost tip of the Americas.</p><p>The Cape Froward national park is a wild expanse of wind-torn coastline and forested valleys that harbours unrivalled biodiversity and has played host to millennia of human history.</p> <a href=""https://www.theguardian.com/world/2025/dec/25/cape-froward-new-national-park-patagonia-chile"">Continue reading...</a>",fact,news
SoftBank to acquire DigitalBridge for $4bn in move to deepen ties to AI,"<p>Acquisition would further expand SoftBank’s investments in artificial intelligence as it tries to center itself in the boom</p><p>SoftBank Group will acquire digital infrastructure investor DigitalBridge Group in a deal valued at $4bn, the companies said on Monday, as the Japanese investment firm looks to deepen its AI-related portfolio.</p><p>The acquisition would expand SoftBank’s exposure to digital infrastructure as the Japanese conglomerate is positioning its portfolio to focus on artificial intelligence.<br /><br />
 SoftBank’s billionaire founder Masayoshi Son is seeking to capitalize on surging demand for the computing capacity that underpins artificial intelligence applications.</p> <a href=""https://www.theguardian.com/technology/2025/dec/29/softbank-digitalbridge-deal-artificial-intelligence"">Continue reading...</a>",fact,news
China launches live-fire drills around Taiwan simulating blockade of major ports,"<p>Taipei condemns exercise that Chinese army calls ‘a stern warning’ against separatist and external forces</p><p>China has launched live-fire military drills around Taiwan, simulating a blockade of major ports, attacking maritime targets, and fending off international “interference”, in what it calls a warning to “separatist” forces in Taiwan.</p><p>The People’s Liberation Army (PLA) – the military wing of the ruling Communist party in China – sent its navy, air force, rocket force and coastguard to surround Taiwan on Monday morning for a surprise exercise called “Justice Mission 2025”, which began less than an hour after it was announced.</p> <a href=""https://www.theguardian.com/world/2025/dec/29/china-live-fire-military-drills-around-taiwan"">Continue reading...</a>",fact,news
"Influx of cheap Chinese imports could drive down UK inflation, economists say","<p>As Trump’s tariffs take effect, Britain is likely alternative destination for cars, telecoms and sound equipment</p><ul><li><p><a href=""https://www.theguardian.com/business/live/2025/dec/29/silver-precious-metals-prices-fed-rate-cut-oil-rises-trump-zelenskyy-meeting-business-live"">Business live – latest updates</a></p></li></ul><p>The UK is poised for an influx of cheap Chinese imports that could bring down inflation amid the fallout from Donald Trump’s global trade war, leading economists have said.</p><p>After figures showed <a href=""https://www.theguardian.com/world/2025/dec/09/chinas-record-high-trade-surplus-reveals-the-difficulty-trump-will-have-in-rebalancing-global-economy"">China’s trade surplus surpassed $1tn</a> (£750bn) despite Washington’s tariff policies hitting exports to the US, the Bank of England said the UK was among the nations emerging as alternative destinations for the goods.</p> <a href=""https://www.theguardian.com/business/2025/dec/29/chinese-imports-uk-inflation-trump-tariffs"">Continue reading...</a>",fact,news
Japanese town reeling from year of record bear encounters,"<p>Bears are becoming a growing problem in some of Japan’s urban areas as they are forced to venture further in search of food</p><p>It came as no surprise, least of all to the residents of Osaki, that “bear” was selected as Japan’s <a href=""https://mainichi.jp/english/articles/20251219/p2a/00m/0na/003000c"">kanji character of the year</a> earlier this month.</p><p>The north-eastern town of 128,000 people is best known for its Naruko Onsen hot springs, autumn foliage and <em>kokeshi</em> – cylindrical dolls carved from a single piece of wood. But this year it has made the headlines as a bear hotspot, as the country reels from a year of record ursine encounters and deaths, with warnings that winter will not bring immediate respite.</p> <a href=""https://www.theguardian.com/world/2025/dec/29/osaki-japan-town-record-bear-encounters-2025"">Continue reading...</a>",fact,news
"Boy, 5, died after arm trapped in ski resort travelator in Japan","<p>Hinata Goto reportedly fell as he was trying to get off the 30-metre-long walkway</p><p>A five-year-old boy has died after becoming trapped in a moving travelator at a ski resort in northern Japan, local media have said.</p><p>The victim, Hinata Goto, died on Sunday after his right arm became trapped in the walkway’s winding mechanism during a family skiing trip to Otaru, a city on Japan’s northernmost island of Hokkaido.</p> <a href=""https://www.theguardian.com/world/2025/dec/29/boy-5-killed-after-arm-trapped-in-ski-resort-travelator-in-japan-hokkaido"">Continue reading...</a>",fact,news
‘My target was just to take the gun’: wounded hero Ahmed al-Ahmed speaks of saving lives at Bondi beach,"<p>‘I know I saved lots, but I feel sorry for the lost,’ Ahmed tells CBS News of those who died in Sydney attack on 14 December</p><ul><li><p>Get our <a href=""https://www.theguardian.com/email-newsletters?CMP=cvau_sfl"">breaking news email</a>, <a href=""https://app.adjust.com/w4u7jx3"">free app</a> or <a href=""https://www.theguardian.com/australia-news/series/full-story?CMP=cvau_sfl"">daily news podcast</a></p></li></ul><p>Ahmed al-Ahmed, who disarmed one of the Bondi gunmen before being shot five times, says he knows his bravery saved many lives but is sad for those who were killed in the attack.</p><p>In an interview with CBS News, Ahmed said he “didn’t worry about anything” except for the lives he could save as he disarmed Sajid Akram on 14 December. The act was <a href=""https://www.theguardian.com/australia-news/2025/dec/14/bystander-tackles-and-wrestles-gun-from-alleged-gunmen-during-bondi-beach-mass-shooting"">caught on camera</a> and shared around the world.</p> <a href=""https://www.theguardian.com/australia-news/2025/dec/29/wounded-hero-ahmed-al-ahmed-speaks-of-saving-lives-at-bondi-beach-ntwnfb"">Continue reading...</a>",fact,news
Queensland to continue to allow farmers to shoot flying foxes after revoking ban on controversial practice,"<p>Conservationists and scientists criticise state for backtracking and say alternative non-lethal methods such as netting are more effective</p><ul><li><p>Get our <a href=""https://www.theguardian.com/email-newsletters?CMP=cvau_sfl"">breaking news email</a>, <a href=""https://app.adjust.com/w4u7jx3"">free app</a> or <a href=""https://www.theguardian.com/australia-news/series/full-story?CMP=cvau_sfl"">daily news podcast</a></p></li></ul><p>The Queensland government has backtracked on plans to end the shooting of flying foxes from July 2026, continuing a practice wildlife advocates and scientists describe as “ineffective” and “inhumane”.</p><p>Permits issued by the state’s environment department allow Queensland farmers to shoot flying foxes for the purposes of crop protection, up to an annual statewide quota set at 1,630 animals. That includes 130 grey-headed flying foxes, listed as vulnerable under federal environment laws, along with 700 black and 800 little red flying foxes.</p> <a href=""https://www.theguardian.com/environment/2025/dec/30/queensland-to-continue-to-allow-farmers-to-shoot-flying-foxes-after-revoking-ban-on-controversial-practice"">Continue reading...</a>",fact,news
Albanese’s refusal to heed families’ pleas for Bondi inquiry is hard to understand – and easy for opposition to attack,"<p>A review of Asio and the federal police is worthwhile, but it’s not a substitute for a royal commission into antisemitism</p><ul><li><p>Get our <a href=""https://www.theguardian.com/email-newsletters?CMP=cvau_sfl"">breaking news email</a>, <a href=""https://app.adjust.com/w4u7jx3"">free app</a> or <a href=""https://www.theguardian.com/australia-news/series/full-story?CMP=cvau_sfl"">daily news podcast</a></p></li></ul><p>When Anthony Albanese opened a press conference on Monday announcing the release of terms of reference for an inquiry into the Bondi massacre, it seemed for a fleeting moment that he had belatedly agreed to hold a commonwealth royal commission.</p><p>The timing would have been understandable, after the <a href=""https://www.theguardian.com/australia-news/2025/dec/29/bondi-shooting-victims-families-royal-commission-ntwnfb"">victims’ families</a> had penned an open letter pleading for one, making the sort of intervention that can be politically untenable for any prime minister to refuse.</p> <a href=""https://www.theguardian.com/australia-news/2025/dec/30/albaneses-refusal-to-heed-families-pleas-for-bondi-inquiry-is-hard-to-understand-and-easy-for-opposition-to-attack-ntwnfb"">Continue reading...</a>",fact,news
"Ten years since David Dungay Jr died in jail, a rally to protest deaths in custody could test NSW’s new laws","<p>Dunghutti man’s nephew says fight for justice ‘is not just political – it is spiritual, cultural, and about survival’</p><ul><li><p>Get our <a href=""https://www.theguardian.com/email-newsletters?CMP=cvau_sfl"">breaking news email</a>, <a href=""https://app.adjust.com/w4u7jx3"">free app</a> or <a href=""https://www.theguardian.com/australia-news/series/full-story?CMP=cvau_sfl"">daily news podcast</a></p></li></ul><p>Since his uncle died in custody at one of New South Wales’ toughest prisons a decade ago, Paul Silva has been advocating for change almost daily. From organising large-scale rallies with thousands in attendance, to sitting through numerous coronial inquiries and supporting families, he says the right to protest is needed now more than ever.</p><p>The nephew of <a href=""https://www.theguardian.com/australia-news/2020/jun/11/the-story-of-david-dungay-and-an-indigenous-death-in-custody"">David Dungay Jr</a>, a Dunghutti man who died at the age of 26 at Long Bay jail in Sydney’s southern suburbs on 29 December 2015, Silva says the fight for justice “is not just political – it is spiritual, cultural, and about survival”.</p> <a href=""https://www.theguardian.com/australia-news/2025/dec/30/david-dungay-jr-protest-deaths-in-custody-nsw-new-laws-ntwnfb"">Continue reading...</a>",fact,news
Pauline Hanson travelled to US on Gina Rinehart’s private jet to attend CPAC,"<p>One Nation senator travelled on mining magnate’s Gulfstream 700 in October and is yet to declare it on parliamentary register </p><p>Pauline Hanson and her chief of staff, James Ashby, flew to Florida on Gina Rinehart’s private jet in October, but the One Nation senator is yet to declare the sponsored travel or answer questions about whether she may be in breach of parliamentary rules.</p><p>Guardian Australia can reveal the One Nation senator and her staffer travelled with Rinehart on the mining magnate’s Gulfstream 700 on 27 October, with publicly available flight tracking data showing that the aircraft travelled from Brisbane to Perth, before flying via Osaka to Palm Beach.</p> <a href=""https://www.theguardian.com/australia-news/2025/dec/30/pauline-hanson-travelled-to-us-on-gina-rineharts-private-jet-to-attend-cpac"">Continue reading...</a>",fact,news
Ukraine war live: Zelenskyy denies Russian accusation that Putin’s residence was attacked by Ukrainian drones,"<p>Zelenskyy says Moscow trying to derail peace talks progress, as Russian foreign minister claims Ukraine targeted president’s home in Novgorod</p><p>The Kremlin spokesperson Dmitry Peskov told journalists this morning that Moscow agreed with Donald Trump’s assessment that talks to end the war were in their final stage.</p><p>As a reminder, Trump said a draft agreement to end the war was nearly “95% done”. “I really think we are closer than ever with both sides,” he said, though he added that “one or two very thorny issues” remain.</p> <a href=""https://www.theguardian.com/world/live/2025/dec/29/ukraine-war-russia-us-zelenskyy-trump-security-guarantees-latest-news-updates"">Continue reading...</a>",fact,news
Kosovo prime minister wins snap election to end political deadlock,"<p>Albin Kurti’s emphatic victory strengthens mandate for domestic reforms including welfare expansion</p><p>Kosovo’s prime minister, Albin Kurti has won an emphatic election victory, marking a resurgence for the nationalist leader and ending a political deadlock in Europe’s youngest state.</p><p>The win in <a href=""https://www.theguardian.com/world/2025/dec/28/kosovo-goes-to-the-polls-in-snap-election-in-bid-to-end-political-crisis"">Sunday’s snap election</a> strengthens Kurti’s mandate to push through domestic reforms, including welfare expansion and higher salaries for public workers, although he faces significant problems including tensions with Serbia and health and education systems that lag behind Kosovo’s Balkan neighbours.</p> <a href=""https://www.theguardian.com/world/2025/dec/29/kosovo-prime-minister-albin-kurti-wins-snap-election-to-end-political-deadlock"">Continue reading...</a>",fact,news
Is claim Ukraine deal is ‘95% done’ just another empty assertion from Trump?,"<p>A sober observer assessing the US president’s claim may react the same way as Zelenskyy – with shock and disbelief</p><ul><li><p><a href=""https://www.theguardian.com/world/2025/dec/29/volodymyr-zelenskyy-donald-trump-us-security-guarantees-ukraine"">Zelenskyy says US has agreed to offer Ukraine ‘strong’ 15-year security guarantees</a></p></li></ul><p>A deal to end the war between Russia and Ukraine was “95% done”, Donald Trump <a href=""https://www.theguardian.com/world/2025/dec/28/trump-zelenskyy-talks-amid-heavy-russian-airstrikes-on-ukraine"">claimed after his meeting</a> over the weekend with Volodymyr Zelenskyy at Mar-a-Lago.</p><p>Unfortunately, the 5% still remaining includes the small matter of getting Vladimir Putin to agree to a deal – and there are precious few indicators that that is any closer. Instead, Trump’s claim seems to be the latest in a long line of overoptimistic statements anticipating a swift end to the conflict, starting with his campaign promise that he would end the war in 24 hours.</p> <a href=""https://www.theguardian.com/world/2025/dec/29/ukraine-deal-trump-russia-zelenskyy"">Continue reading...</a>",fact,news
Zelenskyy says US has agreed to offer Ukraine ‘strong’ 15-year security guarantees,"<p>Future of Donbas region remains unresolved after Ukrainian president’s talks with Donald Trump in Florida</p><ul><li><p><a href=""https://www.theguardian.com/world/live/2025/dec/29/ukraine-war-russia-us-zelenskyy-trump-security-guarantees-latest-news-updates"">Ukraine war – latest updates</a></p></li></ul><p>Volodymyr Zelenskyy says the US has agreed to offer “strong” security guarantees to Ukraine for 15 years, but acknowledged that the future of the country’s eastern Donbas region was unresolved after his <a href=""https://www.theguardian.com/world/2025/dec/28/trump-zelenskyy-talks-amid-heavy-russian-airstrikes-on-ukraine"">two-hour meeting on Sunday</a> with Donald Trump in Florida.</p><p>Speaking on his way back to Europe, Zelenskyy said the US Congress and Ukraine’s parliament would jointly vote on American pledges. These were a key part of a 20-point peace plan discussed with the US president at his Mar-a-Lago residence, he said.</p> <a href=""https://www.theguardian.com/world/2025/dec/29/volodymyr-zelenskyy-donald-trump-us-security-guarantees-ukraine"">Continue reading...</a>",fact,news
Pensions timebomb: why Europe’s social contract is becoming unsustainable,"<p>Ageing populations and falling birthrates have left ever fewer workers to support growing number of retirees</p><p>It has played a starring role in one of the worst periods of political turmoil in France since the 1960s. In Germany, it <a href=""https://www.theguardian.com/world/2025/nov/18/pension-reform-row-threatens-germanys-coalition-government"">threatens the future</a> of the coalition government. In Spain, <a href=""https://www.publico.es/economia/8-000-personas-manifiestan-madrid-pensiones-minimas-iguales-smi-brecha-genero.html"">thousands have taken to the streets</a> to demand change.</p><p>The right to a decent <a href=""https://www.oecd.org/en/publications/2025/11/pensions-at-a-glance-2025_76510fe4/full-report.html"">state pension</a> has been a central plank of the European social contract for decades, but people are living longer, birthrates are falling, and the continent’s pension systems are, increasingly, unsustainable.</p> <a href=""https://www.theguardian.com/money/2025/dec/29/pensions-timebomb-europe-social-contract-becoming-unsustainable"">Continue reading...</a>",fact,news
